{
  "$schema": "https://json-schema.org/draft/2020-12/schema",
  "title": "Place",
  "type": "object",
  "required": [
    "id",
    "name",
    "type",
    "status"
  ],
  "properties": {
    "id": {
      "type": "string",
      "pattern": "^[a-z0-9_]+$"
    },
    "name": {
      "type": "string"
    },
    "type": {
      "type": "string"
    },
    "point": {
      "type": [
        "object",
        "null"
      ],
      "properties": {
        "lat": {
          "type": "number"
        },
        "lon": {
          "type": "number"
        },
        "precision": {
          "type": "string"
        },
        "sourceRefs": {
          "type": "array",
          "items": {
            "type": "string"
          }
        },
        "note": {
          "type": "string"
        }
      },
      "required": [
        "lat",
        "lon"
      ]
    },
    "summary": {
      "type": "string"
    },
    "status": {
      "type": "string"
    },
    "sourceRefs": {
      "type": "array",
      "items": {
        "type": "string"
      }
    },
    "verification": {
      "type": "object",
      "required": [
        "verifiedOn",
        "method",
        "independentSourceRefs",
        "note"
      ],
      "properties": {
        "verifiedOn": {
          "type": "string"
        },
        "method": {
          "type": "string"
        },
        "independentSourceRefs": {
          "type": "array",
          "minItems": 1,
          "items": {
            "type": "string"
          }
        },
        "note": {
          "type": "string",
          "minLength": 1
        }
      }
    }
  }
}