[
  {
    "id": "fertile_crescent_demo",
    "name": "Creciente Fértil (referencia)",
    "type": "macroregion",
    "point": {
      "lat": 34.5,
      "lon": 39.0
    },
    "summary": "Punto visual de referencia para un área amplia; no representa un origen único.",
    "status": "seed"
  },
  {
    "id": "eastern_mediterranean_demo",
    "name": "Mediterráneo oriental (referencia)",
    "type": "macroregion",
    "point": {
      "lat": 35.0,
      "lon": 25.0
    },
    "summary": "Referencia visual para probar ocurrencias mediterráneas.",
    "status": "seed"
  },
  {
    "id": "roman_mediterranean_demo",
    "name": "Mediterráneo romano (referencia)",
    "type": "macroregion",
    "point": {
      "lat": 38.0,
      "lon": 15.0
    },
    "summary": "Referencia visual, no frontera histórica.",
    "status": "seed"
  },
  {
    "id": "south_asia_demo",
    "name": "Asia meridional (referencia)",
    "type": "macroregion",
    "point": {
      "lat": 23.0,
      "lon": 78.0
    },
    "summary": "Referencia visual para el prototipo.",
    "status": "seed"
  },
  {
    "id": "mesoamerica_demo",
    "name": "Mesoamérica (referencia)",
    "type": "macroregion",
    "point": {
      "lat": 17.0,
      "lon": -91.0
    },
    "summary": "Referencia visual para el prototipo.",
    "status": "seed"
  },
  {
    "id": "andes_demo",
    "name": "Andes centrales (referencia)",
    "type": "macroregion",
    "point": {
      "lat": -13.0,
      "lon": -72.0
    },
    "summary": "Referencia visual para el prototipo.",
    "status": "seed"
  },
  {
    "id": "western_europe_demo",
    "name": "Europa occidental (referencia)",
    "type": "macroregion",
    "point": {
      "lat": 47.0,
      "lon": 2.0
    },
    "summary": "Referencia visual para probar introducciones/adopciones.",
    "status": "seed"
  },
  {
    "id": "red_sea_demo",
    "name": "Mar Rojo / Arabia (referencia)",
    "type": "macroregion",
    "point": {
      "lat": 18.0,
      "lon": 42.0
    },
    "summary": "Referencia visual para el prototipo del café.",
    "status": "seed"
  },
  {
    "id": "gadachrili_gora",
    "name": "Gadachrili Gora",
    "type": "site",
    "point": {
      "lat": 41.39055,
      "lon": 44.82084,
      "precision": "approximate",
      "sourceRefs": [
        "src_gadachrili_coords_secondary"
      ],
      "note": "Punto aproximado para visualización; la cronología procede de fuentes académicas independientes."
    },
    "summary": "Yacimiento neolítico en Kvemo Kartli, Georgia, vinculado a la cultura Shulaveri-Shomutepe.",
    "sourceRefs": [
      "src_mcgovern_2017_neolithic_wine",
      "src_cnrs_gadachrili"
    ],
    "status": "reviewed"
  },
  {
    "id": "xihuatoxtla_shelter",
    "name": "Abrigo de Xihuatoxtla",
    "type": "site",
    "point": {
      "lat": 18.37,
      "lon": -99.4,
      "precision": "approximate",
      "sourceRefs": [
        "src_xihuatoxtla_coords_secondary"
      ],
      "note": "Punto aproximado para visualización; el contexto arqueológico procede de PNAS."
    },
    "summary": "Abrigo rocoso del valle central del Balsas, Guerrero, México, con depósitos del Holoceno temprano.",
    "sourceRefs": [
      "src_ranere_2009_balsas_context",
      "src_piperno_2009_balsas_maize"
    ],
    "status": "reviewed"
  },
  {
    "id": "pompeii",
    "name": "Pompeya",
    "type": "city",
    "point": {
      "lat": 40.7508,
      "lon": 14.4869,
      "precision": "reference",
      "sourceRefs": [
        "src_pompeii_antiquarium_garum"
      ],
      "note": "Punto de referencia del yacimiento arqueológico para el mapa."
    },
    "summary": "Ciudad romana del área vesubiana cuyo registro arqueológico conserva materiales relacionados con producción y consumo alimentario.",
    "sourceRefs": [
      "src_pompeii_antiquarium_garum"
    ],
    "status": "reviewed"
  },
  {
    "id": "arbois_france",
    "name": "Arbois (Jura, Francia)",
    "type": "city",
    "point": {
      "lat": 46.903,
      "lon": 5.774,
      "precision": "reference",
      "sourceRefs": [
        "src_pasteur_legacy"
      ],
      "note": "Punto urbano de referencia para los trabajos de Pasteur sobre el vino."
    },
    "summary": "Localidad del Jura donde Pasteur desarrolló parte de sus investigaciones sobre las enfermedades del vino.",
    "sourceRefs": [
      "src_pasteur_legacy"
    ],
    "status": "reviewed"
  },
  {
    "id": "ganj_dareh",
    "name": "Ganj Dareh",
    "type": "site",
    "point": null,
    "summary": "Yacimiento del Neolítico acerámico en los Zagros centrales, cerca de Harsin, Irán occidental.",
    "sourceRefs": [
      "src_goat_zagros_pnas_2021"
    ],
    "status": "reviewed"
  },
  {
    "id": "shubayqa_1",
    "name": "Shubayqa 1",
    "type": "site",
    "point": {
      "lat": 32.406437,
      "lon": 37.2281,
      "precision": "exact_from_publication",
      "sourceRefs": [
        "src_shubayqa_dates_2017"
      ],
      "note": "Coordenadas publicadas en el estudio cronológico del yacimiento."
    },
    "summary": "Yacimiento natufiense del noreste de Jordania, en el Desierto Negro.",
    "sourceRefs": [
      "src_shubayqa_dates_2017",
      "src_shubayqa_bread_pnas_2018"
    ],
    "status": "reviewed"
  },
  {
    "id": "kuyavia_poland",
    "name": "Kuyavia (Polonia central)",
    "type": "historical_region",
    "point": null,
    "summary": "Región de Polonia central donde recipientes perforados neolíticos aportaron evidencia química de procesado lácteo.",
    "sourceRefs": [
      "src_cheese_nature_2013"
    ],
    "status": "reviewed"
  },
  {
    "id": "england_richard_ii_reference",
    "name": "Inglaterra de Ricardo II (referencia)",
    "type": "historical_region",
    "point": null,
    "summary": "Marco geográfico de referencia para The Forme of Cury; no representa una frontera cartográfica precisa.",
    "sourceRefs": [
      "src_forme_cury_bl"
    ],
    "status": "reviewed"
  },
  {
    "id": "areni_1_cave",
    "name": "Cueva Areni-1",
    "type": "site",
    "point": null,
    "summary": "Complejo cavernario de Vayots Dzor, Armenia, con una instalación calcolítica asociada a producción de vino.",
    "sourceRefs": [
      "src_areni_wine_2011"
    ],
    "status": "reviewed"
  },
  {
    "id": "abydos_umm_el_qaab",
    "name": "Abydos · Umm el-Qaab",
    "type": "site",
    "point": {
      "lat": 26.1833,
      "lon": 31.9167,
      "precision": "reference",
      "sourceRefs": [
        "src_unesco_abydos_point"
      ],
      "note": "Punto general de Abydos procedente de UNESCO; no pretende localizar con precisión la tumba U-j."
    },
    "summary": "Área funeraria de Abydos vinculada a los primeros gobernantes egipcios; la tumba U-j proporcionó recipientes con residuos vínicos.",
    "sourceRefs": [
      "src_abydos_wine_2009",
      "src_unesco_abydos_point"
    ],
    "status": "reviewed"
  },
  {
    "id": "tel_kabri",
    "name": "Tel Kabri",
    "type": "site",
    "point": null,
    "summary": "Centro palacial cananeo del Bronce Medio en Galilea occidental, con un complejo de almacenamiento de vino excavado arqueológicamente.",
    "sourceRefs": [
      "src_tel_kabri_wine_2014",
      "src_tel_kabri_archaeobotany_2023"
    ],
    "status": "reviewed"
  },
  {
    "id": "jerusalem_city_of_david_ridge",
    "name": "Jerusalén · cresta de la Ciudad de David",
    "type": "site",
    "point": null,
    "summary": "Área de excavación de Jerusalén con recipientes de almacenamiento destruidos en 586 a.C. y analizados mediante química de residuos.",
    "sourceRefs": [
      "src_jerusalem_vanilla_wine_2022"
    ],
    "status": "reviewed"
  }
]